{
  "schema_version": "v0.1.0",
  "units": "cm",
  "node_spacing": 200,
  "dimensions": {
    "width": 3600,
    "height": 6600
  },
  "regions": [
    {
      "id": 1,
      "name": "southwest",
      "density": "sparse",
      "description": "Generated quadrant of the simulated lattice."
    },
    {
      "id": 2,
      "name": "southeast",
      "density": "sparse",
      "description": "Generated quadrant of the simulated lattice."
    },
    {
      "id": 3,
      "name": "northwest",
      "density": "sparse",
      "description": "Generated quadrant of the simulated lattice."
    },
    {
      "id": 5,
      "name": "region_5",
      "density": "sparse",
      "description": "Generated quadrant of the simulated lattice."
    }
  ],
  "nodes": [
    {
      "id": 0,
      "name": "charging/PT/001",
      "region_id": 3,
      "node_type": "PT",
      "position": {
        "x": 400.0,
        "y": 600.0
      }
    },
    {
      "id": 1,
      "name": "charging/PT/002",
      "region_id": 3,
      "node_type": "PT",
      "position": {
        "x": 600.0,
        "y": 600.0
      }
    },
    {
      "id": 2,
      "name": "charging/PT/003",
      "region_id": 3,
      "node_type": "PT",
      "position": {
        "x": 800.0,
        "y": 600.0
      }
    },
    {
      "id": 3,
      "name": "charging/PT/004",
      "region_id": 3,
      "node_type": "PT",
      "position": {
        "x": 1000.0,
        "y": 600.0
      }
    },
    {
      "id": 4,
      "name": "charging/PT/005",
      "region_id": 3,
      "node_type": "PT",
      "position": {
        "x": 1200.0,
        "y": 600.0
      }
    },
    {
      "id": 5,
      "name": "charging/PT/006",
      "region_id": 3,
      "node_type": "PT",
      "position": {
        "x": 1400.0,
        "y": 600.0
      }
    },
    {
      "id": 6,
      "name": "charging/PT/007",
      "region_id": 3,
      "node_type": "PT",
      "position": {
        "x": 1600.0,
        "y": 600.0
      }
    },
    {
      "id": 7,
      "name": "charging/PT/008",
      "region_id": 3,
      "node_type": "PT",
      "position": {
        "x": 1800.0,
        "y": 600.0
      }
    },
    {
      "id": 8,
      "name": "charging/PT/009",
      "region_id": 3,
      "node_type": "PT",
      "position": {
        "x": 2000.0,
        "y": 600.0
      }
    },
    {
      "id": 9,
      "name": "charging/PT/010",
      "region_id": 3,
      "node_type": "PT",
      "position": {
        "x": 2200.0,
        "y": 600.0
      }
    },
    {
      "id": 10,
      "name": "charging/PT/011",
      "region_id": 3,
      "node_type": "PT",
      "position": {
        "x": 2400.0,
        "y": 600.0
      }
    },
    {
      "id": 11,
      "name": "charging/PT/012",
      "region_id": 3,
      "node_type": "PT",
      "position": {
        "x": 2600.0,
        "y": 600.0
      }
    },
    {
      "id": 12,
      "name": "charging/PT/013",
      "region_id": 3,
      "node_type": "PT",
      "position": {
        "x": 2800.0,
        "y": 600.0
      }
    },
    {
      "id": 13,
      "name": "charging/PT/014",
      "region_id": 3,
      "node_type": "PT",
      "position": {
        "x": 3000.0,
        "y": 600.0
      }
    },
    {
      "id": 14,
      "name": "charging/PT/015",
      "region_id": 3,
      "node_type": "PT",
      "position": {
        "x": 3200.0,
        "y": 600.0
      }
    },
    {
      "id": 53,
      "name": "charging/PT/054",
      "region_id": 3,
      "node_type": "PT",
      "position": {
        "x": 400.0,
        "y": 800.0
      }
    },
    {
      "id": 54,
      "name": "charging/CH/001",
      "region_id": 3,
      "node_type": "CH",
      "position": {
        "x": 800.0,
        "y": 800.0
      }
    },
    {
      "id": 55,
      "name": "charging/CH/002",
      "region_id": 3,
      "node_type": "CH",
      "position": {
        "x": 1400.0,
        "y": 800.0
      }
    },
    {
      "id": 56,
      "name": "charging/CH/003",
      "region_id": 3,
      "node_type": "CH",
      "position": {
        "x": 2000.0,
        "y": 800.0
      }
    },
    {
      "id": 57,
      "name": "charging/CH/004",
      "region_id": 3,
      "node_type": "CH",
      "position": {
        "x": 2600.0,
        "y": 800.0
      }
    },
    {
      "id": 58,
      "name": "charging/CH/005",
      "region_id": 3,
      "node_type": "CH",
      "position": {
        "x": 3200.0,
        "y": 800.0
      }
    },
    {
      "id": 75,
      "name": "charging/PT/059",
      "region_id": 3,
      "node_type": "PT",
      "position": {
        "x": 400.0,
        "y": 1000.0
      }
    },
    {
      "id": 76,
      "name": "charging/PT/060",
      "region_id": 3,
      "node_type": "PT",
      "position": {
        "x": 600.0,
        "y": 1000.0
      }
    },
    {
      "id": 77,
      "name": "charging/PT/061",
      "region_id": 3,
      "node_type": "PT",
      "position": {
        "x": 800.0,
        "y": 1000.0
      }
    },
    {
      "id": 78,
      "name": "charging/PT/062",
      "region_id": 3,
      "node_type": "PT",
      "position": {
        "x": 1000.0,
        "y": 1000.0
      }
    },
    {
      "id": 79,
      "name": "charging/PT/063",
      "region_id": 3,
      "node_type": "PT",
      "position": {
        "x": 1200.0,
        "y": 1000.0
      }
    },
    {
      "id": 80,
      "name": "charging/PT/064",
      "region_id": 3,
      "node_type": "PT",
      "position": {
        "x": 1400.0,
        "y": 1000.0
      }
    },
    {
      "id": 81,
      "name": "charging/PT/065",
      "region_id": 3,
      "node_type": "PT",
      "position": {
        "x": 1600.0,
        "y": 1000.0
      }
    },
    {
      "id": 82,
      "name": "charging/PT/066",
      "region_id": 3,
      "node_type": "PT",
      "position": {
        "x": 1800.0,
        "y": 1000.0
      }
    },
    {
      "id": 83,
      "name": "charging/PT/067",
      "region_id": 3,
      "node_type": "PT",
      "position": {
        "x": 2000.0,
        "y": 1000.0
      }
    },
    {
      "id": 84,
      "name": "charging/PT/068",
      "region_id": 3,
      "node_type": "PT",
      "position": {
        "x": 2200.0,
        "y": 1000.0
      }
    },
    {
      "id": 85,
      "name": "charging/PT/069",
      "region_id": 3,
      "node_type": "PT",
      "position": {
        "x": 2400.0,
        "y": 1000.0
      }
    },
    {
      "id": 86,
      "name": "charging/PT/070",
      "region_id": 3,
      "node_type": "PT",
      "position": {
        "x": 2600.0,
        "y": 1000.0
      }
    },
    {
      "id": 87,
      "name": "charging/PT/071",
      "region_id": 3,
      "node_type": "PT",
      "position": {
        "x": 2800.0,
        "y": 1000.0
      }
    },
    {
      "id": 88,
      "name": "charging/PT/072",
      "region_id": 3,
      "node_type": "PT",
      "position": {
        "x": 3000.0,
        "y": 1000.0
      }
    },
    {
      "id": 89,
      "name": "charging/PT/073",
      "region_id": 3,
      "node_type": "PT",
      "position": {
        "x": 3200.0,
        "y": 1000.0
      }
    },
    {
      "id": 128,
      "name": "charging/PT/112",
      "region_id": 3,
      "node_type": "PT",
      "position": {
        "x": 400.0,
        "y": 1200.0
      }
    },
    {
      "id": 129,
      "name": "charging/CH/018",
      "region_id": 3,
      "node_type": "CH",
      "position": {
        "x": 800.0,
        "y": 1200.0
      }
    },
    {
      "id": 130,
      "name": "charging/CH/019",
      "region_id": 3,
      "node_type": "CH",
      "position": {
        "x": 1400.0,
        "y": 1200.0
      }
    },
    {
      "id": 131,
      "name": "charging/CH/020",
      "region_id": 3,
      "node_type": "CH",
      "position": {
        "x": 2000.0,
        "y": 1200.0
      }
    },
    {
      "id": 132,
      "name": "charging/CH/021",
      "region_id": 3,
      "node_type": "CH",
      "position": {
        "x": 2600.0,
        "y": 1200.0
      }
    },
    {
      "id": 133,
      "name": "charging/CH/022",
      "region_id": 3,
      "node_type": "CH",
      "position": {
        "x": 3200.0,
        "y": 1200.0
      }
    },
    {
      "id": 150,
      "name": "charging/PT/117",
      "region_id": 3,
      "node_type": "PT",
      "position": {
        "x": 400.0,
        "y": 1400.0
      }
    },
    {
      "id": 151,
      "name": "bulk_and_storage_cols_1_2/PT/001",
      "region_id": 5,
      "node_type": "PT",
      "position": {
        "x": 600.0,
        "y": 1400.0
      }
    },
    {
      "id": 152,
      "name": "bulk_and_storage_cols_1_2/TR/001",
      "region_id": 5,
      "node_type": "TR",
      "position": {
        "x": 800.0,
        "y": 1400.0
      }
    },
    {
      "id": 153,
      "name": "bulk_and_storage_cols_1_2/PT/002",
      "region_id": 5,
      "node_type": "PT",
      "position": {
        "x": 1000.0,
        "y": 1400.0
      }
    },
    {
      "id": 154,
      "name": "bulk_and_storage_cols_1_2/PT/003",
      "region_id": 5,
      "node_type": "PT",
      "position": {
        "x": 1200.0,
        "y": 1400.0
      }
    },
    {
      "id": 155,
      "name": "bulk_and_storage_cols_1_2/PT/004",
      "region_id": 5,
      "node_type": "PT",
      "position": {
        "x": 1400.0,
        "y": 1400.0
      }
    },
    {
      "id": 156,
      "name": "bulk_and_storage_cols_1_2/PT/005",
      "region_id": 5,
      "node_type": "PT",
      "position": {
        "x": 1600.0,
        "y": 1400.0
      }
    },
    {
      "id": 157,
      "name": "bulk_and_storage_cols_1_2/PT/006",
      "region_id": 5,
      "node_type": "PT",
      "position": {
        "x": 1800.0,
        "y": 1400.0
      }
    },
    {
      "id": 158,
      "name": "bulk_and_storage_cols_1_2/TR/002",
      "region_id": 5,
      "node_type": "TR",
      "position": {
        "x": 2000.0,
        "y": 1400.0
      }
    },
    {
      "id": 159,